items,freq
white hanging heart t-light holder,1919
regency cakestand 3 tier,1627
jumbo bag red retrospot,1573
assorted colour bird ornament,1358
party bunting,1351
lunch bag red retrospot,1266
set of 3 cake tins pantry design,1112
lunch bag  black skull.,1039
pack of 72 retrospot cake cases,992
spotty bunting,980
lunch bag spaceboy design,978
paper chain kit 50's christmas,963
natural slate heart chalkboard,951
lunch bag cars blue,948
heart of wicker small,943
lunch bag pink polkadot,914
lunch bag suki design,892
wooden picture frame white finish,870
jumbo bag pink polkadot,864
rex cash+carry jumbo shopper,858
alarm clock bakelike red,855
lunch bag apple design,852
set of 4 pantry jelly moulds,846
jam making set with jars,838
jam making set printed,829
baking set 9 piece retrospot,824
lunch bag woodland,806
victorian glass hanging t-light,803
retrospot tea set ceramic 11 pc,802
recipe box pantry yellow design,801
wooden frame antique white,800
heart of wicker large,794
rabbit night light,787
jumbo shopper vintage red paisley,782
alarm clock bakelike green,781
jumbo storage bag suki,768
jumbo bag vintage leaf,751
gardeners kneeling pad keep calm,749
set/5 red retrospot lid glass bowls,742
roses regency teacup and saucer,734
red retrospot charlotte bag,733
jumbo bag alphabet,732
6 ribbons rustic charm,713
set/20 red retrospot paper napkins,712
hot water bottle keep calm,708
jumbo bag apples,705
paper chain kit vintage christmas,688
spaceboy lunch box,688
vintage snap cards,683
set of 3 regency cake tins,679
home building block word,679
please one person metal sign,678
chocolate hot water bottle,678
red hanging heart t-light holder,659
green regency teacup and saucer,653
pack of 60 pink paisley cake cases,648
jumbo bag strawberry,645
scottie dog hot water bottle,644
gin + tonic diet metal sign,644
doormat keep calm and come in,641
jumbo  bag baroque black white,641
set of 6 spice tins pantry design,638
gardeners kneeling pad cup of tea,631
lunch bag alphabet design,631
60 teatime fairy cake cases,630
clothes pegs retrospot pack 24,620
jumbo bag vintage doily,607
popcorn holder,607
dolly girl lunch box,597
alarm clock bakelike pink,594
jumbo bag pink vintage paisley,592
hand over the chocolate   sign,589
lunch bag vintage leaf design,588
lunch bag dolly girl design,587
wood black board ant white finish,587
round snack boxes set of4 woodland,586
ivory kitchen scales,582
cook with wine metal sign,579
charlotte bag suki design,579
jumbo bag 50's christmas,579
small white heart of wicker,577
plasters in tin woodland animals,576
plasters in tin spaceboy,571
hand warmer owl design,568
doormat red retrospot,561
gumball coat rack,560
paper bunting retrospot,557
hanging heart jar t-light holder,555
love building block word,545
red  harmonica in box,540
"jumbo bag pink polkadot', 'jumbo bag red retrospot",540
gingerbread man cookie cutter,537
lunch bag vintage doily,528
antique silver t-light glass,527
pink cream felt craft trinket box,527
pink regency teacup and saucer,526
woodland charlotte bag,524
"alarm clock bakelike green', 'alarm clock bakelike red",524
colour glass t-light holder hanging,520
retrospot heart hot water bottle,520
doormat union flag,515
red toadstool led night light,513
pack of 20 napkins pantry design,513
chilli lights,512
doormat new england,511
set of 3 heart cookie cutters,510
"lunch bag pink polkadot', 'lunch bag red retrospot",510
pack of 60 dinosaur cake cases,510
"lunch bag  black skull.', 'lunch bag red retrospot",508
wood 2 drawer cabinet white finish,506
"green regency teacup and saucer', 'roses regency teacup and saucer",506
traditional knitting nancy,506
hot water bottle tea and sympathy,504
large white heart of wicker,504
homemade jam scented candles,502
lunch box i love london,501
plasters in tin circus parade,501
blue harmonica in box,500
grey heart hot water bottle,499
strawberry ceramic trinket box,498
hot water bottle i am so poorly,490
pack of 72 skull cake cases,490
strawberry charlotte bag,486
set of 3 butterfly cookie cutters,485
jumbo bag woodland animals,485
set of 60 pantry design cake cases,483
charlotte bag pink polkadot,482
72 sweetheart fairy cake cases,480
hand warmer bird design,473
vintage heads and tails card game,473
plasters in tin vintage paisley,471
jumbo bag spaceboy design,471
set of 20 vintage christmas napkins,469
jumbo storage bag skulls,469
hand warmer scotty dog design,468
zinc metal heart decoration,468
"wooden frame antique white', 'wooden picture frame white finish",466
doormat hearts,465
jumbo bag pears,462
alarm clock bakelike ivory,461
"gardeners kneeling pad cup of tea', 'gardeners kneeling pad keep calm",461
"lunch bag spaceboy design', 'lunch bag red retrospot",460
lunch bag doiley pattern,458
"lunch bag pink polkadot', 'lunch bag  black skull.",455
world war 2 gliders asstd designs,454
feltcraft 6 flower friends,453
round snack boxes set of 4 fruits,452
pink blue felt craft trinket box,452
set of 12 fairy cake baking cases,451
jumbo bag doiley patterns,450
"lunch bag cars blue', 'lunch bag red retrospot",449
60 cake cases vintage christmas,448
"lunch bag suki design', 'lunch bag red retrospot",448
wooden heart christmas scandinavian,447
cream heart card holder,445
jumbo bag scandinavian blue paisley,445
"paper chain kit vintage christmas', ""paper chain kit 50's christmas",444
hand warmer union jack,441
"red hanging heart t-light holder', 'white hanging heart t-light holder",439
wooden box of dominoes,439
love hot water bottle,438
travel card wallet keep calm,437
paper chain kit retrospot,436
childrens apron spaceboy design,436
plasters in tin skulls,433
plasters in tin strongman,433
photo frame cornice,432
"pink regency teacup and saucer', 'green regency teacup and saucer",432
cream sweetheart mini chest,432
"jumbo storage bag suki', 'jumbo bag red retrospot",431
recipe box retrospot,428
feltcraft butterfly hearts,428
"lunch bag woodland', 'lunch bag red retrospot",427
enamel flower jug cream,427
red kitchen scales,424
charlotte bag apples design,421
"lunch bag pink polkadot', 'lunch bag cars blue",421
strawberry lunch box with cutlery,420
"lunch bag red retrospot', 'jumbo bag red retrospot",419
"lunch bag cars blue', 'lunch bag  black skull.",417
wooden star christmas scandinavian,416
christmas craft little friends,415
"lunch bag spaceboy design', 'lunch bag  black skull.",413
baking set spaceboy design,412
"dolly girl lunch box', 'spaceboy lunch box",411
bathroom metal sign,411
feltcraft cushion owl,408
"jumbo bag strawberry', 'jumbo bag red retrospot",407
"pink regency teacup and saucer', 'roses regency teacup and saucer",407
red retrospot cake stand,406
"lunch bag suki design', 'lunch bag  black skull.",406
set of 20 kids cookie cutters,405
recycling bag retrospot,405
jumbo bag owls,403
"lunch bag woodland', 'lunch bag spaceboy design",402
"heart of wicker large', 'heart of wicker small",400
hanging heart zinc t-light holder,400
red diner wall clock,399
pack of 60 spaceboy cake cases,393
"jumbo shopper vintage red paisley', 'jumbo bag red retrospot",392
small popcorn holder,391
3 stripey mice feltcraft,391
spaceboy birthday card,390
feltcraft princess charlotte doll,388
doormat spotty home sweet home,388
vintage union jack bunting,388
"roses regency teacup and saucer', 'regency cakestand 3 tier",387
"lunch bag cars blue', 'lunch bag spaceboy design",386
pink fairy cake childrens apron,386
"lunch bag suki design', 'lunch bag cars blue",386
"lunch bag apple design', 'lunch bag red retrospot",384
set of 3 wooden heart decorations,383
hot baths metal sign,381
travel sewing kit,381
"alarm clock bakelike pink', 'alarm clock bakelike red",381
red retrospot shopper bag,380
"spotty bunting', 'party bunting",380
pack of 12 london tissues,380
jumbo bag vintage christmas,380
no singing metal sign,380
ivory diner wall clock,378
"lunch bag suki design', 'lunch bag spaceboy design",376
wooden school colouring set,376
sweetheart ceramic trinket box,376
white skull hot water bottle,372
red retrospot picnic bag,372
fawn blue hot water bottle,372
paper chain kit empire,372
area patrolled metal sign,371
doormat fancy font home sweet home,370
chocolate this way metal sign,369
wood s/3 cabinet ant white finish,368
hand warmer red love heart,368
party metal sign,368
set of tea coffee sugar tins pantry,368
set 2 tea towels i love london,367
white wood garden plant ladder,367
feltcraft princess lola doll,367
pottering in the shed metal sign,367
"pink regency teacup and saucer', 'green regency teacup and saucer', 'roses regency teacup and saucer",363
"lunch bag pink polkadot', 'lunch bag spaceboy design",363
pantry magnetic  shopping list,361
ladies & gentlemen metal sign,360
edwardian parasol natural,360
box of 6 mini 50's crackers,359
"jumbo  bag baroque black white', 'jumbo bag red retrospot",357
small dolly mix design orange bowl,356
"lunch bag apple design', 'lunch bag suki design",356
"lunch bag suki design', 'lunch bag pink polkadot",356
assorted colour mini cases,355
set of 72 retrospot paper  doilies,355
box of 24 cocktail parasols,354
"lunch bag woodland', 'lunch bag cars blue",353
vintage christmas bunting,353
beware of the cat metal sign,352
red retrospot mini cases,351
"lunch bag dolly girl design', 'lunch bag spaceboy design",351
alarm clock bakelike orange,351
set of 12 mini loaf baking cases,351
pack of 12 hearts design tissues,348
"green regency teacup and saucer', 'regency cakestand 3 tier",348
pink happy birthday bunting,347
vintage doily travel sewing kit,346
"jumbo bag apples', 'jumbo bag red retrospot",346
4 traditional spinning tops,345
red retrospot peg bag,345
doormat english rose,345
blue stripe ceramic drawer knob,345
"lunch bag woodland', 'lunch bag  black skull.",343
memo board retrospot  design,342
blue happy birthday bunting,342
painted metal pears assorted,342
metal sign take it or leave it,340
"jumbo bag vintage leaf', 'jumbo bag red retrospot",340
charlotte bag dolly girl design,340
hand warmer red retrospot,339
small glass heart trinket pot,338
60 cake cases dolly girl design,337
"alarm clock bakelike pink', 'alarm clock bakelike green",337
poppy's playhouse kitchen,336
set of 10 led dolly lights,336
christmas craft tree top angel,336
traditional wooden skipping rope,334
set of 6 soldier skittles,334
regency teapot roses,333
metal 4 hook hanger french chateau,332
set/10 red polkadot party candles,331
traditional modelling clay,331
you're confusing me metal sign,331
ribbon reel stripes design,330
zinc folkart sleigh bells,330
single heart zinc t-light holder,330
scandinavian reds ribbons,329
candleholder pink hanging heart,328
red retrospot wrap,328
open closed metal sign,327
card billboard font,327
soldiers egg cup,327
doormat welcome to our home,326
"jumbo bag pink vintage paisley', 'jumbo bag red retrospot",326
playing cards keep calm & carry on,325
"pack of 60 pink paisley cake cases', 'pack of 72 retrospot cake cases",325
i'm on holiday metal sign,324
box of 6 mini vintage crackers,324
lunch box with cutlery retrospot,323
bread bin diner style ivory,323
set of 6 ribbons vintage christmas,322
gingham heart decoration,320
"charlotte bag pink polkadot', 'red retrospot charlotte bag",320
assorted colours silk fan,320
blue diner wall clock,319
christmas craft white fairy,318
red stripe ceramic drawer knob,318
sweetheart cakestand 3 tier,318
knitted union flag hot water bottle,317
charlotte bag vintage alphabet,317
set/6 red spotty paper plates,316
"lunch bag apple design', 'lunch bag  black skull.",316
feltcraft cushion rabbit,316
enamel bread bin cream,315
"lunch bag woodland', 'lunch bag pink polkadot",315
"60 teatime fairy cake cases', 'pack of 72 retrospot cake cases",315
red woolly hottie white heart.,314
mini paint set vintage,314
pack of 6 birdy gift tags,313
jumbo bag dolly girl design,313
clear drawer knob acrylic edwardian,312
black record cover frame,312
alarm clock bakelike chocolate,312
childrens cutlery spaceboy,311
set of 3 notebooks in parcel,311
lovebird hanging decoration white,310
set of 6 tea time baking cases,309
childrens cutlery polkadot pink,309
scandinavian paisley picnic bag,309
"wooden star christmas scandinavian', 'wooden heart christmas scandinavian",309
"alarm clock bakelike ivory', 'alarm clock bakelike red",309
set of 4 knick knack tins doily,308
"jumbo bag pears', 'jumbo bag apples",308
enamel measuring jug cream,308
tea time party bunting,308
poppy's playhouse bedroom,307
jingle bell heart decoration,306
pack of 12 traditional crayons,306
"lunch bag apple design', 'lunch bag spaceboy design",306
"wooden picture frame white finish', 'white hanging heart t-light holder",306
12 pencils small tube red retrospot,305
pack of 20 napkins red apples,304
"lunch bag woodland', 'lunch bag suki design",304
doughnut lip gloss,303
natural slate rectangle chalkboard,303
set 2 pantry design tea towels,302
bundle of 3 alphabet exercise books,302
"lunch bag dolly girl design', 'lunch bag red retrospot",302
set/3 red gingham rose storage box,302
"lunch bag vintage leaf design', 'lunch bag apple design",301
regency tea plate roses,301
"lunch bag alphabet design', 'lunch bag apple design",301
"lunch bag pink polkadot', 'lunch bag  black skull.', 'lunch bag red retrospot",301
set of 72 pink heart paper doilies,300
giant 50's christmas cracker,299
"baking set spaceboy design', 'baking set 9 piece retrospot",299
retrospot large milk jug,299
jumbo bag paisley park,298
toilet metal sign,298
wicker star,298
rotating silver angels t-light hldr,298
multi colour silver t-light holder,297
set/10 pink polkadot party candles,297
hanging jam jar t-light holder,297
natural slate chalkboard large,297
white spot red ceramic drawer knob,297
red retrospot small milk jug,296
3 hook photo shelf antique white,296
"charlotte bag suki design', 'red retrospot charlotte bag",296
wooden union jack bunting,296
lunch bag paisley park,295
set of 60 i love london cake cases,294
"lunch bag woodland', 'lunch bag apple design",294
feltcraft christmas fairy,294
"jumbo bag alphabet', 'jumbo bag red retrospot",293
red retrospot bowl,293
wooden rounders garden set,293
set 7 babushka nesting boxes,293
"jumbo bag strawberry', 'jumbo bag pink polkadot",292
travel card wallet vintage ticket,292
"jumbo bag apples', 'lunch bag apple design",292
"strawberry charlotte bag', 'red retrospot charlotte bag",292
"jam making set printed', 'jam making set with jars",291
3 piece spaceboy cookie cutter set,291
red retrospot umbrella,291
"set of 6 spice tins pantry design', 'set of 3 cake tins pantry design",291
pantry washing up brush,290
set of 60 vintage leaf cake cases,290
"plasters in tin spaceboy', 'plasters in tin woodland animals",289
12 pencils small tube skull,289
washroom metal sign,289
hand warmer babushka design,288
"pink regency teacup and saucer', 'regency cakestand 3 tier",287
"heart of wicker large', 'white hanging heart t-light holder",287
vintage cream dog food container,287
"lunch bag apple design', 'lunch bag pink polkadot",287
toy tidy pink polkadot,286
"woodland charlotte bag', 'red retrospot charlotte bag",286
"green regency teacup and saucer', 'roses regency teacup and saucer', 'regency cakestand 3 tier",286
small marshmallows pink bowl,285
feltcraft doll molly,285
home sweet home mug,285
traditional wooden catch cup game,285
"jumbo bag vintage doily', 'jumbo bag red retrospot",285
retrospot childrens apron,284
"lunch bag apple design', 'lunch bag cars blue",284
feltcraft cushion butterfly,284
blue spot ceramic drawer knob,283
mint kitchen scales,281
"large white heart of wicker', 'small white heart of wicker",280
"jumbo storage bag suki', 'jumbo bag pink polkadot",280
"hand warmer scotty dog design', 'hand warmer owl design",280
place setting white heart,280
ceramic strawberry cake money bank,279
set of 6 snack loaf baking cases,279
revolver wooden ruler,279
pink vintage paisley picnic bag,278
"hot water bottle i am so poorly', 'chocolate hot water bottle",278
chick grey hot water bottle,278
set/6 red spotty paper cups,278
set 20 napkins fairy cakes design,277
edwardian parasol black,277
red spot ceramic drawer knob,276
"jumbo bag apples', 'jumbo bag vintage leaf",276
antique silver tea glass engraved,276
london bus coffee mug,276
treasure tin gymkhana design,276
set 12 kids colour  chalk sticks,276
"red retrospot charlotte bag', 'jumbo bag red retrospot",275
red retrospot cup,274
12 pencil small tube woodland,274
family album white picture frame,273
"lunch bag pink polkadot', 'lunch bag cars blue', 'lunch bag red retrospot",273
childrens apron apples design,273
"party bunting', 'white hanging heart t-light holder",273
aged glass silver t-light holder,273
"lunch bag pink polkadot', 'jumbo bag red retrospot",273
pack of 60 mushroom cake cases,272
"alarm clock bakelike ivory', 'alarm clock bakelike green",272
vintage christmas stocking,272
watering can blue elephant,272
hanging metal heart lantern,272
set 6 school milk bottles in crate,271
"jumbo bag apples', 'jumbo bag alphabet",269
english rose hot water bottle,269
white wicker star,268
"love building block word', 'home building block word",268
"cook with wine metal sign', 'gin + tonic diet metal sign",268
"lunch bag  black skull.', 'jumbo bag red retrospot",268
"60 teatime fairy cake cases', 'pack of 60 pink paisley cake cases",267
roll wrap 50's christmas,267
"hand warmer bird design', 'hand warmer owl design",267
sweetheart recipe book stand,267
set of 3 hanging owls ollie beak,266
heart ivory trellis large,266
white spot blue ceramic drawer knob,266
biscuit tin 50's christmas,266
set of 3 wooden stocking decoration,266
bingo set,265
retrospot party bag + sticker set,265
save the planet mug,265
"key fob , shed",264
wooden tree christmas scandinavian,264
traditional christmas ribbons,264
"blue harmonica in box', 'red  harmonica in box",264
childrens cutlery dolly girl,263
"jumbo bag spaceboy design', 'jumbo bag red retrospot",263
skull lunch box with cutlery,263
"jumbo bag scandinavian blue paisley', 'jumbo bag red retrospot",263
"natural slate heart chalkboard', 'white hanging heart t-light holder",262
"lunch bag vintage leaf design', 'lunch bag red retrospot",262
"assorted colour bird ornament', 'white hanging heart t-light holder",262
ivory wicker heart large,262
"lunch bag dolly girl design', 'lunch bag  black skull.",261
"cook with wine metal sign', 'hand over the chocolate   sign",261
"alarm clock bakelike pink', 'alarm clock bakelike green', 'alarm clock bakelike red",261
"round snack boxes set of 4 fruits', 'round snack boxes set of4 woodland",260
"jumbo bag woodland animals', 'jumbo bag red retrospot",260
"heart of wicker small', 'white hanging heart t-light holder",260
3 hearts hanging decoration rustic,259
set 6 paper table lantern hearts,259
"lunch bag cars blue', 'lunch bag  black skull.', 'lunch bag red retrospot",258
"pack of 60 dinosaur cake cases', 'pack of 72 retrospot cake cases",257
"lunch bag pink polkadot', 'lunch bag cars blue', 'lunch bag  black skull.",257
classic metal birdcage plant holder,256
"hot water bottle tea and sympathy', 'chocolate hot water bottle",256
6 gift tags 50's christmas,256
edwardian parasol red,256
memo board cottage design,255
t-light glass fluted antique,255
"lunch bag woodland', 'lunch bag spaceboy design', 'lunch bag red retrospot",255
red retrospot oven glove,255
"recipe box pantry yellow design', 'set of 3 cake tins pantry design",254
"lunch bag dolly girl design', 'lunch bag suki design",254
paper bunting white lace,254
pack of 12 suki tissues,254
"cook with wine metal sign', 'please one person metal sign",254
"lunch bag alphabet design', 'lunch bag red retrospot",254
lantern cream gazebo,253
"wooden frame antique white', 'white hanging heart t-light holder",253
"jumbo bag pink vintage paisley', 'jumbo shopper vintage red paisley",253
"lunch bag spaceboy design', 'lunch bag  black skull.', 'lunch bag red retrospot",253
"lunch bag alphabet design', 'lunch bag suki design",253
"lunch bag cars blue', 'jumbo bag red retrospot",252
laundry 15c metal sign,252
"lunch bag vintage leaf design', 'lunch bag suki design",252
four hook  white lovebirds,252
"jumbo bag pink vintage paisley', 'jumbo bag pink polkadot",251
red floral feltcraft shoulder bag,251
red retrospot round cake tins,251
toilet sign occupied or vacant,251
"pink regency teacup and saucer', 'green regency teacup and saucer', 'regency cakestand 3 tier",250
"lunch bag suki design', 'lunch bag  black skull.', 'lunch bag red retrospot",250
"plasters in tin circus parade', 'plasters in tin woodland animals",250
robot birthday card,250
tea party birthday card,250
"lunch bag suki design', 'lunch bag pink polkadot', 'lunch bag red retrospot",250
happy stencil craft,250
vintage snakes & ladders,249
"jumbo storage bag suki', 'jumbo shopper vintage red paisley",249
children's apron dolly girl,249
"jumbo bag alphabet', 'jumbo bag vintage leaf",249
"jumbo  bag baroque black white', 'jumbo bag pink polkadot",248
"painted metal pears assorted', 'assorted colour bird ornament",248
6 gift tags vintage christmas,248
"lunch bag dolly girl design', 'lunch bag woodland",248
christmas lights 10 reindeer,248
piggy bank retrospot,248
"hand over the chocolate   sign', 'gin + tonic diet metal sign",248
"fancy font birthday card,",247
"lunch bag pink polkadot', 'lunch bag spaceboy design', 'lunch bag red retrospot",247
"jumbo storage bag skulls', 'jumbo bag red retrospot",247
doormat home sweet home blue,247
black/blue polkadot umbrella,247
silver hanging t-light holder,246
regency tea plate green,246
single antique rose hook ivory,246
feltcraft doll rosie,246
circus parade lunch box,246
picnic basket wicker large,246
"poppy's playhouse bedroom"", ""poppy's playhouse kitchen",246
grand chocolatecandle,246
regency milk jug pink,245
feltcraft girl amelie kit,245
set 12 retro white chalk sticks,245
"jumbo bag pink polkadot', 'lunch bag pink polkadot",245
tea bag plate red retrospot,245
jumbo bag toys,245
feltcraft princess olivia doll,244
"blue happy birthday bunting', 'pink happy birthday bunting",244
"jumbo bag red retrospot', 'white hanging heart t-light holder",244
poppy's playhouse livingroom,244
"pack of 72 skull cake cases', 'pack of 72 retrospot cake cases",244
"red kitchen scales', 'ivory kitchen scales",244
"vintage heads and tails card game', 'vintage snap cards",244
heart filigree dove  small,244
"jumbo shopper vintage red paisley', 'jumbo bag pink polkadot",243
"lunch bag vintage leaf design', 'lunch bag  black skull.",243
"pink regency teacup and saucer', 'roses regency teacup and saucer', 'regency cakestand 3 tier",243
"chocolate hot water bottle', 'hot water bottle keep calm",243
ice cream sundae lip gloss,243
"jumbo bag vintage christmas', ""jumbo bag 50's christmas",242
"lunch bag vintage doily', 'lunch bag red retrospot",242
"lunch bag alphabet design', 'lunch bag spaceboy design",242
roll wrap vintage spot,242
airline bag vintage tokyo 78,242
roll wrap vintage christmas,242
small heart measuring spoons,242
wrap english rose,241
regency sugar bowl green,241
"set of 12 mini loaf baking cases', 'set of 12 fairy cake baking cases",241
"candleholder pink hanging heart', 'white hanging heart t-light holder",241
jazz hearts purse notebook,241
bag 125g swirly marbles,241
"hand warmer scotty dog design', 'hand warmer bird design",240
"jumbo  bag baroque black white', 'jumbo storage bag suki",240
"alarm clock bakelike orange', 'alarm clock bakelike red",240
"lunch bag vintage leaf design', 'lunch bag alphabet design",240
"lunch bag alphabet design', 'lunch bag  black skull.",240
pack of 12 red retrospot tissues,240
"plasters in tin circus parade', 'plasters in tin spaceboy",240
"lunch bag dolly girl design', 'lunch bag cars blue",239
"woodland charlotte bag', 'charlotte bag suki design",239
set of 3 wooden sleigh decorations,239
set of 3 wooden tree decorations,239
classic glass cookie jar,239
"set of 3 butterfly cookie cutters', 'set of 3 heart cookie cutters",238
jam jar with pink lid,238
"jumbo bag pink polkadot', 'lunch bag red retrospot",238
set of 3 cake tins sketchbook,238
picture dominoes,238
home sweet home metal sign,237
set of 2 tea towels apple and pears,237
"jumbo storage bag suki', 'lunch bag red retrospot",237
cream cupid hearts coat hanger,237
"jumbo bag pears', 'jumbo bag vintage leaf",237
tea time oven glove,237
10 colour spaceboy pen,237
"jumbo  bag baroque black white', 'jumbo shopper vintage red paisley",236
"red retrospot charlotte bag', 'lunch bag red retrospot",236
round cake tin vintage red,236
"jumbo bag scandinavian blue paisley', 'jumbo bag pink vintage paisley",236
swallows greeting card,235
doormat welcome puppies,235
"lunch bag suki design', 'lunch bag cars blue', 'lunch bag red retrospot",235
bath building block word,235
"hand over the chocolate   sign', 'please one person metal sign",234
"lunch bag woodland', 'lunch bag pink polkadot', 'lunch bag red retrospot",234
bundle of 3 retro note books,234
doorstop retrospot heart,234
"scottie dog hot water bottle', 'chocolate hot water bottle",234
"gin + tonic diet metal sign', 'please one person metal sign",234
"pink blue felt craft trinket box', 'pink cream felt craft trinket box",233
"key fob , back door",233
doormat fairy cake,233
ceramic heart fairy cake money bank,233
queens guard coffee mug,233
"jam making set with jars', 'set of 3 cake tins pantry design",233
"lunch bag suki design', 'jumbo bag red retrospot",232
watering can pink bunny,232
white metal lantern,232
vintage doily jumbo bag red,231
"strawberry charlotte bag', 'charlotte bag suki design",231
zinc t-light holder stars small,231
set of 4 knick knack tins london,231
christmas star wish list chalkboard,231
set of 36 teatime paper doilies,231
traditional pick up sticks game,231
vintage cream cat food container,231
"lunch bag dolly girl design', 'lunch bag pink polkadot",231
grow a flytrap or sunflower in tin,231
potting shed tea mug,231
"jumbo bag strawberry', 'jumbo bag pink polkadot', 'jumbo bag red retrospot",231
"set 3 retrospot tea,coffee,sugar",230
