items,freq
12 pencils tall tube red retrospot,230
"alarm clock bakelike ivory', 'alarm clock bakelike pink",230
"lunch bag cars blue', 'lunch bag spaceboy design', 'lunch bag red retrospot",230
calendar paper cut design,229
"feltcraft princess lola doll', 'feltcraft princess charlotte doll",229
pantry scrubbing brush,229
"set/6 red spotty paper cups', 'set/6 red spotty paper plates",229
"hot water bottle tea and sympathy', 'hot water bottle keep calm",228
retrospot red washing up gloves,228
set of 6 herb tins sketchbook,228
"set of 3 regency cake tins', 'regency cakestand 3 tier",228
wooden croquet garden set,228
biscuit tin vintage christmas,228
fancy fonts birthday wrap,228
"lunch bag suki design', 'lunch bag spaceboy design', 'lunch bag red retrospot",228
"lunch bag alphabet design', 'lunch bag cars blue",227
strawberry shopper bag,227
set 12 colour pencils spaceboy,227
bread bin diner style red,227
victorian sewing box small,226
coffee mug apples design,226
childrens cutlery retrospot red,226
"assorted colour bird ornament', 'regency cakestand 3 tier",226
"regency cakestand 3 tier', 'white hanging heart t-light holder",226
"lunch bag alphabet design', 'jumbo bag alphabet",226
"lunch bag woodland', 'lunch bag  black skull.', 'lunch bag red retrospot",226
miniature antique rose hook ivory,226
picnic basket wicker small,226
chocolate box ribbons,225
giraffe wooden ruler,225
family photo frame cornice,225
"lunch bag woodland', 'lunch bag cars blue', 'lunch bag red retrospot",225
"retrospot tea set ceramic 11 pc', 'baking set 9 piece retrospot",225
"charlotte bag pink polkadot', 'charlotte bag suki design",225
"lunch bag vintage leaf design', 'lunch bag spaceboy design",224
recipe box blue sketchbook design,224
magnets pack of 4 swallows,223
pink floral feltcraft shoulder bag,223
wooden happy birthday garland,223
36 pencils tube red retrospot,223
"small marshmallows pink bowl', 'small dolly mix design orange bowl",222
"lunch bag pink polkadot', 'lunch bag spaceboy design', 'lunch bag  black skull.",222
"toilet metal sign', 'bathroom metal sign",222
box of vintage alphabet blocks,221
feltcraft doll emily,221
"lunch bag alphabet design', 'lunch bag pink polkadot",221
"jumbo storage bag suki', 'lunch bag suki design",221
"party bunting', 'regency cakestand 3 tier",221
"set/6 red spotty paper plates', 'set/20 red retrospot paper napkins",221
set/10 blue polkadot party candles,221
set of 36 paisley flower doilies,221
"jumbo bag apples', 'jumbo bag pink polkadot",221
"lunch bag vintage doily', 'jumbo bag vintage doily",221
"lunch bag red retrospot', 'white hanging heart t-light holder",221
"lunch bag suki design', 'lunch bag cars blue', 'lunch bag  black skull.",221
"jumbo bag vintage doily', 'jumbo bag vintage leaf",220
"lunch bag apple design', 'jumbo bag red retrospot",220
blue polkadot bowl,220
"lunch bag cars blue', 'lunch bag spaceboy design', 'lunch bag  black skull.",220
"lunch bag suki design', 'lunch bag pink polkadot', 'lunch bag  black skull.",220
"lunch bag woodland', 'lunch bag suki design', 'lunch bag red retrospot",220
"lunch bag pink polkadot', 'lunch bag cars blue', 'lunch bag spaceboy design",219
wrap alphabet design,219
picture frame wood triple portrait,219
ribbon reel hearts design,219
"jumbo storage bag suki', 'jumbo bag pink polkadot', 'jumbo bag red retrospot",219
heart ivory trellis small,219
kitchen metal sign,219
"alarm clock bakelike chocolate', 'alarm clock bakelike red",218
"pink regency teacup and saucer', 'green regency teacup and saucer', 'roses regency teacup and saucer', 'regency cakestand 3 tier",218
"lunch bag suki design', 'lunch bag spaceboy design', 'lunch bag  black skull.",217
red retrospot plate,217
"alarm clock bakelike orange', 'alarm clock bakelike green",217
pink polkadot bowl,217
"lunch bag apple design', 'lunch bag suki design', 'lunch bag red retrospot",216
colour glass. star t-light holder,216
"wooden tree christmas scandinavian', 'wooden star christmas scandinavian",216
peg bag apples design,215
large heart measuring spoons,215
"pack of 60 dinosaur cake cases', '60 teatime fairy cake cases",214
french enamel candleholder,214
red metal box top secret,214
"love hot water bottle', 'hot water bottle keep calm",214
deluxe sewing kit,214
recycled acapulco mat turquoise,214
"72 sweetheart fairy cake cases', 'pack of 72 retrospot cake cases",214
"jumbo bag strawberry', 'jumbo storage bag suki",214
blue polkadot cup,214
12 pencils tall tube skulls,214
large ceramic top storage jar,213
"retrospot heart hot water bottle', 'scottie dog hot water bottle",213
colouring pencils brown tube,213
set/2 red retrospot tea towels,213
english rose notebook a7 size,213
ivory wicker heart medium,213
heart filigree dove large,212
parisienne jewellery drawer,212
"jumbo bag doiley patterns', 'lunch bag doiley pattern",212
"strawberry charlotte bag', 'woodland charlotte bag",212
"lunch bag spaceboy design', 'jumbo bag red retrospot",212
"alarm clock bakelike ivory', 'alarm clock bakelike green', 'alarm clock bakelike red",212
decorative wicker heart large,212
red gingham rose jewellery box,211
traditional naughts & crosses,211
"plasters in tin strongman', 'plasters in tin circus parade",211
silver bells table decoration,211
"72 sweetheart fairy cake cases', '60 teatime fairy cake cases",211
"lunch bag dolly girl design', 'lunch bag spaceboy design', 'lunch bag red retrospot",210
"charlotte bag apples design', 'red retrospot charlotte bag",210
retrospot cigar box matches,209
"hand warmer union jack', 'hand warmer owl design",209
card dolly girl,209
treasure island book box,209
set of 4 jam jar magnets,209
card circus parade,208
blue polkadot wrap,208
"lunch bag woodland', 'lunch bag cars blue', 'lunch bag spaceboy design",208
bubblegum ring assorted,208
"set of 6 tea time baking cases', 'set of 12 fairy cake baking cases",208
"poppy's playhouse livingroom"", ""poppy's playhouse kitchen",208
"lunch bag woodland', 'lunch bag spaceboy design', 'lunch bag  black skull.",207
"charlotte bag pink polkadot', 'strawberry charlotte bag",207
ice cream pen lip gloss,207
"alarm clock bakelike chocolate', 'alarm clock bakelike green",207
"regency tea plate green', 'regency tea plate roses",207
"jumbo storage bag skulls', 'jumbo bag pink polkadot",207
set of 9 heart shaped balloons,207
"pack of 60 spaceboy cake cases', 'pack of 72 retrospot cake cases",207
"jumbo bag vintage leaf', 'jumbo shopper vintage red paisley",206
vintage donkey tail game,206
brocade ring purse,206
vintage leaf magnetic notepad,206
parisienne key cabinet,205
"red stripe ceramic drawer knob', 'blue stripe ceramic drawer knob",205
triple hook antique ivory rose,205
vintage union jack memoboard,205
"childrens cutlery dolly girl', 'childrens cutlery spaceboy",204
"set of 3 cake tins pantry design', 'regency cakestand 3 tier",204
"home building block word', 'white hanging heart t-light holder",204
ivory hanging decoration  heart,204
"lunch bag suki design', 'lunch bag pink polkadot', 'lunch bag cars blue",204
travel card wallet transport,204
pink polkadot wrap,204
gaolers keys decorative garden,203
12 pencils tall tube woodland,203
"set of tea coffee sugar tins pantry', 'set of 3 cake tins pantry design",203
"lunch bag suki design', 'lunch bag cars blue', 'lunch bag spaceboy design",203
pack of 20 skull paper napkins,203
"sweetheart ceramic trinket box', 'strawberry ceramic trinket box",203
box of vintage jigsaw blocks,202
jam jar with green lid,202
"jumbo  bag baroque black white', 'jumbo bag strawberry",202
"jumbo bag pears', 'jumbo bag red retrospot",202
set 6 paper table lantern stars,202
"lunch bag vintage leaf design', 'jumbo bag vintage leaf",202
"set/20 red retrospot paper napkins', 'pack of 72 retrospot cake cases",202
"christmas craft white fairy', 'christmas craft little friends",201
french wc sign blue metal,201
"recipe box retrospot', 'recipe box pantry yellow design",201
"lunch bag apple design', 'lunch bag  black skull.', 'lunch bag red retrospot",201
"hand warmer red love heart', 'hand warmer owl design",201
regency tea plate pink,201
"jumbo bag spaceboy design', 'jumbo bag pink polkadot",201
"small white heart of wicker', 'heart of wicker small",201
cowboys and indians birthday card,201
suki  shoulder bag,201
"lunch bag dolly girl design', 'lunch bag apple design",201
strawberry   picnic bag,200
floral folk stationery set,200
spaceboy mini backpack,200
childs breakfast set spaceboy,200
"lunch bag vintage leaf design', 'lunch bag cars blue",200
pink  polkadot cup,200
15cm christmas glass ball 20 lights,200
magic drawing slate spaceboy,200
"jumbo bag owls', 'jumbo bag red retrospot",200
romantic pinks ribbons,199
"lunch bag apple design', 'lunch bag suki design', 'lunch bag  black skull.",199
"red retrospot charlotte bag', 'lunch bag  black skull.",199
"jumbo bag vintage leaf', 'jumbo storage bag suki",199
"wood 2 drawer cabinet white finish', 'wooden picture frame white finish",198
"poppy's playhouse livingroom"", ""poppy's playhouse bedroom",198
photo frame 3 classic hanging,198
"lunch bag vintage doily', 'lunch bag  black skull.",198
red spotty biscuit tin,198
"lunch bag woodland', 'lunch bag pink polkadot', 'lunch bag spaceboy design",198
"spaceboy lunch box', 'lunch bag spaceboy design",198
red retrospot butter dish,198
childrens cutlery polkadot blue,198
classic cafe sugar dispenser,198
spaceboy gift wrap,197
pink heart shape egg frying pan,197
jingle bell heart antique silver,197
vintage paisley stationery set,197
"lunch bag alphabet design', 'lunch bag woodland",197
set/20 strawberry paper napkins,197
"jumbo bag spaceboy design', 'jumbo storage bag suki",197
"jumbo bag pink polkadot', 'lunch bag  black skull.",197
"jumbo bag pink vintage paisley', 'jumbo bag strawberry",197
"jumbo bag woodland animals', 'jumbo bag pink polkadot",197
"jumbo bag scandinavian blue paisley', 'jumbo shopper vintage red paisley",197
"feltcraft cushion rabbit', 'feltcraft cushion owl",196
home sweet home cushion cover,196
"jumbo bag apples', 'lunch bag red retrospot",196
"jumbo storage bag skulls', 'jumbo storage bag suki",196
"lunch bag vintage leaf design', 'lunch bag pink polkadot",196
pottering mug,196
pink baby bunting,196
"jumbo bag vintage leaf', 'jumbo bag pink polkadot",196
"jumbo bag alphabet', 'jumbo bag pink polkadot",196
ribbon reel christmas sock bauble,196
"""record frame 7"""" single size""",195
wood stamp set thank you,195
triple photo frame cornice,195
"lunch bag woodland', 'lunch bag pink polkadot', 'lunch bag  black skull.",195
"plasters in tin strongman', 'plasters in tin woodland animals",195
"jumbo bag doiley patterns', 'jumbo bag vintage leaf",195
glass apothecary bottle perfume,195
"christmas craft tree top angel', 'christmas craft little friends",194
"feltcraft cushion butterfly', 'feltcraft cushion rabbit",194
"jumbo bag pink vintage paisley', 'jumbo storage bag suki",194
bull dog bottle opener,194
"pink vintage paisley picnic bag', 'scandinavian paisley picnic bag",194
"lunch bag apple design', 'lunch bag spaceboy design', 'lunch bag red retrospot",193
"charlotte bag pink polkadot', 'woodland charlotte bag",193
"lunch bag pink polkadot', 'white hanging heart t-light holder",193
"jam making set printed', 'set of 3 cake tins pantry design",193
pack of 12 coloured pencils,193
red retrospot sugar jam bowl,193
"lunch bag woodland', 'lunch bag pink polkadot', 'lunch bag cars blue",193
3 traditional biscuit cutters  set,193
"pack of 60 dinosaur cake cases', 'pack of 60 pink paisley cake cases",193
"lunch bag doiley pattern', 'lunch bag apple design",192
set of salt and pepper toadstools,192
toy tidy spaceboy,192
"set of 6 snack loaf baking cases', 'set of 12 fairy cake baking cases",192
"plasters in tin vintage paisley', 'plasters in tin woodland animals",192
"large white heart of wicker', 'heart of wicker large",192
"lunch bag woodland', 'lunch bag cars blue', 'lunch bag  black skull.",192
"jumbo bag apples', 'jumbo storage bag suki",192
"jumbo shopper vintage red paisley', 'lunch bag red retrospot",191
"lunch bag apple design', 'lunch bag pink polkadot', 'lunch bag red retrospot",191
"wooden tree christmas scandinavian', 'wooden heart christmas scandinavian",191
"set of 4 pantry jelly moulds', 'set of 3 cake tins pantry design",191
vintage christmas gift sack,191
decorative wicker heart medium,191
"set of 3 cake tins pantry design', 'white hanging heart t-light holder",190
"lunch bag woodland', 'lunch bag apple design', 'lunch bag red retrospot",190
"ivory diner wall clock', 'red diner wall clock",190
"hand warmer union jack', 'hand warmer scotty dog design",190
gin and tonic mug,190
round cake tin vintage green,190
small purple babushka notebook,190
small red babushka notebook,190
"charlotte bag suki design', 'lunch bag red retrospot",190
set of 5 pancake day magnets,190
"pack of 72 retrospot cake cases', 'lunch bag red retrospot",190
"lunch bag pink polkadot', 'lunch bag cars blue', 'lunch bag  black skull.', 'lunch bag red retrospot",190
"party bunting', 'assorted colour bird ornament",189
playing cards jubilee union jack,189
enchanted bird coathanger 5 hook,189
monsters stencil craft,189
"jumbo bag alphabet', 'jumbo storage bag suki",189
"plasters in tin strongman', 'plasters in tin spaceboy",188
"lunch bag vintage leaf design', 'lunch bag woodland",188
"lunch bag vintage doily', 'lunch bag spaceboy design",188
"lunch bag vintage doily', 'lunch bag suki design",188
"set of 6 snack loaf baking cases', 'set of 12 mini loaf baking cases",188
bag 250g swirly marbles,188
"hand warmer red retrospot', 'hand warmer owl design",187
herb marker mint,187
watering can green dinosaur,187
"jumbo bag scandinavian blue paisley', 'jumbo bag pink polkadot",187
medium ceramic top storage jar,187
coffee mug pears  design,187
"jumbo shopper vintage red paisley', 'jumbo bag pink polkadot', 'jumbo bag red retrospot",187
"pack of 72 skull cake cases', 'pack of 60 dinosaur cake cases",186
set 3 paper vintage chick paper egg,186
"charlotte bag dolly girl design', 'red retrospot charlotte bag",186
"set of 6 tea time baking cases', 'set of 12 mini loaf baking cases",186
"set/6 red spotty paper cups', 'set/20 red retrospot paper napkins",186
set of 36 doilies pantry design,185
ceramic cherry cake money bank,185
"jumbo storage bag skulls', 'lunch bag  black skull.",185
"lunch bag dolly girl design', 'lunch bag woodland', 'lunch bag spaceboy design",185
"wood 2 drawer cabinet white finish', 'wooden frame antique white",185
small red retrospot windmill,185
"jumbo bag pink polkadot', 'lunch bag red retrospot', 'jumbo bag red retrospot",185
silver stars table decoration,185
antique glass dressing table pot,185
balloons  writing set,185
"jumbo storage bag suki', 'jumbo shopper vintage red paisley', 'jumbo bag red retrospot",185
"hot water bottle i am so poorly', 'hot water bottle tea and sympathy",185
"hot water bottle i am so poorly', 'hot water bottle keep calm",185
set of 5 lucky cat magnets,185
"lunch bag spaceboy design', 'white hanging heart t-light holder",184
"lunch bag vintage doily', 'lunch bag apple design",184
12 message cards with envelopes,184
zinc willie winkie  candle stick,184
herb marker rosemary,184
fairy cake flannel assorted colour,184
"regency sugar bowl green', 'regency milk jug pink",184
"lunch bag pink polkadot', 'lunch bag red retrospot', 'jumbo bag red retrospot",184
pack of 12 woodland tissues,184
"72 sweetheart fairy cake cases', 'pack of 60 dinosaur cake cases",184
"lunch bag  black skull.', 'white hanging heart t-light holder",184
"lunch bag woodland', 'lunch bag suki design', 'lunch bag  black skull.",184
set 12 kids  white chalk sticks,183
"60 cake cases dolly girl design', 'pack of 72 retrospot cake cases",183
zinc herb garden container,183
"lunch bag cars blue', 'white hanging heart t-light holder",183
herb marker basil,183
metal sign empire tea,183
travel card wallet suki,183
"jumbo storage bag suki', 'lunch bag  black skull.",183
"charlotte bag apples design', 'lunch bag apple design",182
herb marker thyme,182
gin & tonic diet greeting card,182
"jumbo bag vintage leaf', 'lunch bag red retrospot",182
set of 5 mini grocery magnets,182
"jumbo bag pink vintage paisley', 'jumbo bag pink polkadot', 'jumbo bag red retrospot",182
red retrospot childrens umbrella,182
"lunch bag dolly girl design', 'lunch bag spaceboy design', 'lunch bag  black skull.",182
herb marker parsley,182
"lunch bag apple design', 'lunch bag suki design', 'lunch bag spaceboy design",182
"regency tea plate pink', 'regency tea plate green",181
ribbon reel christmas present,181
"lunch bag woodland', 'jumbo bag red retrospot",181
"pack of 60 spaceboy cake cases', 'pack of 60 dinosaur cake cases",181
travel card wallet union jack,181
treasure tin buffalo bill,181
"jumbo bag pink polkadot', 'lunch bag cars blue",181
polyester filler pad 40x40cm,181
"plasters in tin vintage paisley', 'plasters in tin spaceboy",181
"jumbo bag 50's christmas"", ""paper chain kit 50's christmas",181
"lunch bag woodland', 'lunch bag suki design', 'lunch bag spaceboy design",181
kneeling mat housework  design,181
